id,uuid,question,assessment_id,user_id,options,correct_answer,question_score,class_id,subject_id,is_synced,created_at,updated_at
1159,2e8eadc6-dd6a-48d1-9250-26b0a840aca0,"One of these is not a concern of Health Economics ",2,1,"[""Lifestyle Patterns"", ""Efficiency"", ""Effectiveness"", ""Value""]","Lifestyle Patterns",2,3,10,0,"2023-09-25 08:56:13","2023-09-25 08:56:13"
1160,d5c3fa33-865c-4a90-a47e-6e9b116e9e7a,"Long-run improvement in health have been tied to economic growth through three broad mechanisms which include all except______",2,1,"[""Better Nutrition"", ""Enhancement in Public Health infrastructure"", ""More effective medical technology"", ""High cost of drugs""]","High cost of drugs",2,3,10,0,"2023-09-25 08:56:13","2023-09-25 08:56:13"
1161,b5c48418-8989-4c8e-afa0-256e0c318471,"Which is not true about citizens of Nations with higher average incomes",2,1,"[""They tend to live longer and have fewer years of disability"", ""The women have lower rates of anaemia"", ""Babies have lower birth weights"", ""Children growing up are healthier""]","Babies have lower birth weights",2,3,10,0,"2023-09-25 08:56:13","2023-09-25 08:56:13"
1162,a9c77a77-6f1b-4ced-addd-6598ce9f265d,"Which is not true about citizens of a slowing economy",2,1,"[""It is associated with greater mortality"", ""Lower economy and greater poverty are strongly associated "", ""There is an increased rate of employment"", ""Childhood illness rates are slower""]","Childhood illness rates are slower",2,3,10,0,"2023-09-25 08:56:13","2023-09-25 08:56:13"
1163,48d65d47-fff6-41e2-af20-0a8568b5f38e,"The impact of economic recession on the Nigerian health care delivery system include the following except______",2,1,"[""Decrease in out of pocket ependiture on health"", ""Emergence of counterfeit drugs"", ""High disease morbidity and mortality"", ""Poor functionong of the health sector""]","Decrease in out of pocket ependiture on health",2,3,10,0,"2023-09-25 08:56:13","2023-09-25 08:56:13"
1164,e14e1486-68b1-45a4-9989-027f0de86427,"To strengthen the Nigeria economy, the health care system should be given attention in order to surpress the cycle of all of the folowing except______",2,1,"[""Ill Health"", ""High cost of treatment"", ""Poverty"", ""Under employment""]","High cost of treatment",2,3,10,0,"2023-09-25 08:56:13","2023-09-25 08:56:13"
1165,606b1bdc-b28e-4c13-b0a1-aaaa29b2c0b2,"The value of all the final goods and services in a country in a given year is called _____",2,1,"[""Consumption rate"", ""Gross Domestic Product"", ""Gross Investment Production"", ""Gross National Product""]","Gross Domestic Product",2,3,10,0,"2023-09-25 08:56:13","2023-09-25 08:56:13"
1166,f8029684-d3d3-400d-a003-493b0a5117f5,"To calculate Gross National Product is the sum of four aggregates which are the following except _____",2,1,"[""Personal consumption expenditure"", ""Gross Private Domestic Investment"", ""Gross Export - Gross Import"", ""Government purchase of goods and services""]","Gross Export - Gross Import",2,3,10,0,"2023-09-25 08:56:13","2023-09-25 08:56:13"
1167,9480ec48-72ea-41f1-b2cd-69d9d5c2cdab,"Gross Domestic Product is calculated by adding the following except ______",2,1,"[""Consumption"", ""Investment"", ""Government Expenditure"", ""Personal income""]","Personal income",2,3,10,0,"2023-09-25 08:56:13","2023-09-25 08:56:13"
1168,1fdc59c0-96db-4493-9afb-69d8cd571a53,"One of the following is not a type of Gross Domestic Product",2,1,"[""Real GDP"", ""Cardinal GDP"", ""Nominal GDP"", ""Per Capita GDP""]","Cardinal GDP",2,3,10,0,"2023-09-25 08:56:13","2023-09-25 08:56:13"
1169,54c14ae3-055a-4877-8bdb-dc02d5479ab0,"The value of all goods and services produced in a country at current prices is called _____",2,1,"[""Per Capita GDP"", ""Cardinal GDP"", ""Nominal GDP"", ""Real GDP""]","Nominal GDP",2,3,10,0,"2023-09-25 08:56:13","2023-09-25 08:56:13"
1170,88b833db-a68b-48d1-a287-8eb0b9ac89c7,"The value of all goods and services produced in a country adjusted for inflation is called _____",2,1,"[""Cardinal GDP"", ""Nominal GDP"", ""Per Capita GDP"", ""Real GDP""]","Cardinal GDP",2,3,10,0,"2023-09-25 08:56:13","2023-09-25 08:56:13"
1171,2b73db2f-0877-4467-8a40-4eb723f51cab,"The value of all goods and services produced in a country divided by the population is called _____",2,1,"[""Cardinal GDP"", ""Nominal GDP"", ""Per Capita GDP"", ""Real GDP""]","Per Capita GDP",2,3,10,0,"2023-09-25 08:56:13","2023-09-25 08:56:13"
1172,97786bd2-cb29-44e3-846a-6166210bb1e4,"One of these is not a component of Gross domestic product",2,1,"[""Government Spending"", ""Imports"", ""Exports"", ""Investments""]",Imports,2,3,10,0,"2023-09-25 08:56:13","2023-09-25 08:56:13"
1173,9c9109a1-ced8-4052-9c90-7aed2b1120bf,"By domestic it means",2,1,"[""The things that are produced outside our domestic borders"", ""The things that are produced within our domestic borders"", ""The things that are produced by foreigners and citizens within our domestic borders"", ""The things that are produced in our state capitals even if by foreigners""]","The things that are produced by foreigners and citizens within our domestic borders",2,3,10,0,"2023-09-25 08:56:13","2023-09-25 08:56:13"
1174,e9c1b6c7-75ff-4cc3-a223-08461d229eaa,"Which of the components of GDP is the largest and is a measure of all spending by households in goods and services",2,1,"[""Investment "", ""Government spending"", ""Exports"", ""Consumption""]",Consumption,2,3,10,0,"2023-09-25 08:56:13","2023-09-25 08:56:13"
1175,7e774fb7-8045-4ea5-a4ce-f13d5bbd2d2d,"_______ measures only the nations production",2,1,"[""Gross National Product"", ""Gross Domestic Product"", ""Gross Investment Product"", ""Gross Consumption Product""]","Gross National Product",2,3,10,0,"2023-09-25 08:56:13","2023-09-25 08:56:13"
1176,2e9407a0-5c63-4517-a1cc-e51b304f4f93,"____ highlights the strength of the country's economy",2,1,"[""Gross National Product"", ""Gross Domestic Product"", ""Gross Investment Product"", ""Gross Consumption Product""]","Gross Domestic Product",2,3,10,0,"2023-09-25 08:56:13","2023-09-25 08:56:13"
1177,209dd98a-9d56-4223-8f0f-d979c6fd1103,"The disadvantage of Gross Domestic products are all except______",2,1,"[""GDP does not represent the allocation of resources across a cross-section"", ""Factors leading to environment degradation are often ignored"", ""Financial assests between hands are ignored"", ""GDP does not distinguish between qualitative improvement in the state of the technical arts""]","GDP does not distinguish between qualitative improvement in the state of the technical arts",2,3,10,0,"2023-09-25 08:56:13","2023-09-25 08:56:13"
1178,55c77f87-6d84-4d8a-9a54-bca1b4c16481,"_______ have been used to analyse the reason for rising health cost, projecting future trends and researching policy options",2,1,"[""Gross National Product"", ""Gross Domestic Product"", ""National Health Expenditure"", ""Gross Investment Product""]","National Health Expenditure",2,3,10,0,"2023-09-25 08:56:13","2023-09-25 08:56:13"
1179,9f01dbc8-a703-4420-b767-e0e31656d6db,"______ is the measure of the ability of Government to finance health care",2,1,"[""Traditional estimate on National Health Expenditure"", ""The goods and services that are produced by foreigners"", ""The emphasis on the production that is achieved by the citizens"", ""The incremental cost of health care as a proportion of the incremental change in GNP""]","The incremental cost of health care as a proportion of the incremental change in GNP",2,3,10,0,"2023-09-25 08:56:13","2023-09-25 08:56:13"
1180,7dc8995a-1aea-4b7f-a33e-f6aaba3ef056,"The consequences of poor health financing in Nigeria results to the following Except",2,1,"[""High maternal and child morbiditry and martality ratio"", ""Women and children have hiher rates of anaemia"", ""People tend to live longer and experience fewer years of disabaility"", ""Babies are born with very low birth weights""]","People tend to live longer and experience fewer years of disabaility",2,3,10,0,"2023-09-25 08:56:13","2023-09-25 08:56:13"
1181,4803d936-6c44-47fa-b7eb-58edc4b8ec5a,"The major factor that affects the overall contribution of the health system to economic growth and development in Nigeria is",2,1,"[""Technical"", ""Political"", ""Government"", ""Citizenry""]",Political,2,3,10,0,"2023-09-25 08:56:13","2023-09-25 08:56:13"
1182,28ae3c7d-8134-4887-a252-ffead4394823,"Which of these is not a socio-economic factor influencing Nigeria's Econoy and its effect on provision of health care",2,1,"[""Lack of basic infrastructure and equipment"", ""Lack of consumer awareness and participation"", ""Poor renumeration and motivation"", ""Poor human resources and management""]","Lack of basic infrastructure and equipment",2,3,10,0,"2023-09-25 08:56:13","2023-09-25 08:56:13"
1183,cb894eeb-543b-478d-bd37-0b9b1db0cdfa,"Political factors influencing Nigeria's economy and its effect on the provision of health care services include the following except",2,1,"[""Very low government spending on health"", ""High out of pocket expenditure in health"", ""Lack of fair and sustainable health care financing"", ""Inadequate laboratory facilities""]","High out of pocket expenditure in health",2,3,10,0,"2023-09-25 08:56:13","2023-09-25 08:56:13"
1184,1a473cc9-9b1d-4070-b012-7f1e38011eab,"What is one significant impact of the rising cost of healthcare on individuals?",2,1,"[""Improved health outcomes"", ""Reduced financial burdens"", ""Compromised health outcomes"", ""Increased accessibility""]","Compromised health outcomes",2,3,10,0,"2023-09-25 08:56:13","2023-09-25 08:56:13"
1185,4c6f9d92-33e4-4383-a115-caf88fd9a4de,"In a country with a private insurance-based healthcare system, access to healthcare may be influenced by:",2,1,"[""Government funding"", ""Income, employment status, and insurance coverage"", ""Universal coverage for all citizens"", ""High healthcare expenditure""]","Income, employment status, and insurance coverage",2,3,10,0,"2023-09-25 08:56:13","2023-09-25 08:56:13"
1186,481f5194-b7b1-4429-87c0-e14643a26e45,"Healthcare expenditure is positively correlated with:",2,1,"[""Reduced healthcare access"", ""Lower quality of healthcare services"", ""Better health outcomes"", ""Economic instability""]","Better health outcomes",2,3,10,0,"2023-09-25 08:56:13","2023-09-25 08:56:13"
1187,e34b3bbe-6b79-4153-8e7e-c660c8cb9f9c,"Health inequalities are influenced by factors such as income inequality, unemployment rates, and:",2,1,"[""Access to advanced medical technologies"", ""Educational attainment"", ""Government funding"", ""Healthcare expenditure""]","Educational attainment",2,3,10,0,"2023-09-25 08:56:13","2023-09-25 08:56:13"
1188,81a1fffe-47b5-4441-8974-401cb570c4b6,"What can result from inadequate healthcare workforce planning and maldistribution?",2,1,"[""Lower healthcare costs"", ""Increased access to healthcare services"", ""Healthcare worker shortages"", ""Improved work environment""]","Healthcare worker shortages",2,3,10,0,"2023-09-25 08:56:13","2023-09-25 08:56:13"
1189,2150965b-2ae6-4b58-8819-0d4f55b836d8,"How do high-cost medical innovations impact healthcare expenditures?",2,1,"[""Reduce healthcare costs"", ""Have no impact on costs"", ""Lead to cost savings"", ""Contribute to rising expenditures""]","Contribute to rising expenditures",2,3,10,0,"2023-09-25 08:56:13","2023-09-25 08:56:13"
1190,18bb66fa-3ae2-44d9-b3d9-df1a3c8c604b,"In countries with higher public health expenditure, which of the following is typically true?",2,1,"[""Lower healthcare accessibility"", ""Poorer healthcare outcomes"", ""Greater availability of services"", ""Reduced need for preventive measures""]","Greater availability of services",2,3,10,0,"2023-09-25 08:56:14","2023-09-25 08:56:14"
1191,fd65af04-3b72-4d04-b0be-2b92701668d6,"What impact does the presence of a dominant private healthcare sector have on healthcare delivery?",2,1,"[""Improved healthcare quality"", ""Greater healthcare affordability"", ""Consistent healthcare access"", ""Variations in quality, affordability, and access""]","Variations in quality, affordability, and access",2,3,10,0,"2023-09-25 08:56:14","2023-09-25 08:56:14"
1192,68a0b01e-dbd9-4e4c-85c3-b784ec2dbf08,"Balancing intellectual property rights, competition, and affordability is crucial in addressing issues related to:",2,1,"[""Public health expenditure"", ""Healthcare workforce planning"", ""Pharmaceutical pricing and access"", ""Private healthcare sector dominance""]","Pharmaceutical pricing and access",2,3,10,0,"2023-09-25 08:56:14","2023-09-25 08:56:14"
1193,67717e8d-5ef5-418d-a12b-c7cf4ea1adad,"______is the focus of adequate investment in public health infrastructure, preventive measures, and health promotion programs",2,1,"[""Increasing immediate healthcare costs"", ""Generating revenue for healthcare providers"", ""Reducing the burden of disease"", ""Exclusively serving high-income individuals""]","Reducing the burden of disease",2,3,10,0,"2023-09-25 08:56:14","2023-09-25 08:56:14"
1194,37a3cd7b-88ad-4d8c-8c7d-4d67477fa63e,"What is the primary implication of the design and structure of health financing systems on healthcare access and financial protection?",2,1,"[""Improved healthcare equity and efficiency"", ""Reduced healthcare quality"", ""Increased healthcare costs"", ""Minimal impact on healthcare outcomes""]","Improved healthcare equity and efficiency",2,3,10,0,"2023-09-25 08:56:14","2023-09-25 08:56:14"
1195,9bf90848-2f22-4e4a-a549-a284cdb83b47,"Which of the following statements about the relationship between economic development and health outcomes is true?",2,1,"[""Economic development is generally associated with better health indicators."", ""Investments in education and infrastructure have no impact on health indicators."", ""Higher economic development always leads to worse health outcomes."", ""Health disparities are unrelated to economic development.""]","Economic development is generally associated with better health indicators.",2,3,10,0,"2023-09-25 08:56:14","2023-09-25 08:56:14"
1196,61a7e8fa-e176-4a07-9cb2-a23a828d81b9,"How do global economic factors impact healthcare in low-income countries?",2,1,"[""Adequate funding and equitable resource distribution are crucial for addressing global health challenges"", ""Global economic factors primarily affect high-income countries."", ""They have no impact on healthcare in low-income countries."", ""Low-income countries are not affected by global health financing mechanisms.""]","Adequate funding and equitable resource distribution are crucial for addressing global health challenges",2,3,10,0,"2023-09-25 08:56:14","2023-09-25 08:56:14"
1197,80022211-208d-4cb5-b900-a6c104028fdc,"Collaboration among healthcare providers is essential for:",2,1,"[""Increasing healthcare costs"", ""Fragmented and uncoordinated care"", ""Delivering comprehensive and coordinated care"", ""Reducing patient involvement in decision-making""]","Delivering comprehensive and coordinated care",2,3,10,0,"2023-09-25 08:56:14","2023-09-25 08:56:14"
1198,b8ead520-0f7e-4b51-acbd-9bfa9b3ae1f5,"Public health agencies collaborate with healthcare providers to focus on:",2,1,"[""Disease treatment"", ""Health promotion and disease prevention"", ""Private healthcare services"", ""Reducing access to healthcare""]","Health promotion and disease prevention",2,3,10,0,"2023-09-25 08:56:14","2023-09-25 08:56:14"
1199,525ef2d5-7b25-4f06-9a90-82a3e68d3e2c,"Collaboration between health ministries and other government agencies is important to address:",2,1,"[""Healthcare provider shortages"", ""Social determinants of health"", ""Pharmaceutical pricing"", ""Academic research""]","Social determinants of health",2,3,10,0,"2023-09-25 08:56:14","2023-09-25 08:56:14"
1200,08da12ef-f6d4-4ebf-807a-74679cb163f3,"Non-Governmental Organizations (NGOs) often complement healthcare efforts by:",2,1,"[""Limiting community engagement"", ""Increasing healthcare costs"", ""Providing community resources"", ""Ignoring health disparities""]","Providing community resources",2,3,10,0,"2023-09-25 08:56:14","2023-09-25 08:56:14"
1201,12f55160-c76e-4f37-b1a6-bef44a2e0b75,"Research and academic institutions collaborate with healthcare providers to:",2,1,"[""Limit evidence-based practice"", ""Impede innovation"", ""Advance medical knowledge and improve patient outcomes"", ""Focus solely on education""]","Advance medical knowledge and improve patient outcomes",2,3,10,0,"2023-09-25 08:56:14","2023-09-25 08:56:14"
1202,7e5593b2-a891-4509-befd-107e2aa3b534,"The private sector contributes to healthcare through avenues such as pharmaceutical companies and medical device manufacturers by:",2,1,"[""Opposing research and development"", ""Reducing access to innovative treatments"", ""Collaborating on research and development, technology implementation, and health system strengthening"", ""Ignoring healthcare delivery ""]","Collaborating on research and development, technology implementation, and health system strengthening",2,3,10,0,"2023-09-25 08:56:14","2023-09-25 08:56:14"
1203,7c6b6f7b-f9cd-4268-a1ef-6728506d2072,"Community-based organizations and civil society groups collaborate with healthcare providers to:",2,1,"[""Isolate communities from healthcare initiatives"", ""Disregard local health needs"", ""Limit health education initiatives"", ""Address local health needs and ensure community participation""]","Address local health needs and ensure community participation",2,3,10,0,"2023-09-25 08:56:14","2023-09-25 08:56:14"
1204,6e804044-d2e9-4d22-87e1-cbe3f633b05f,"Effective collaboration in healthcare sectors requires:",2,1,"[""Isolation and lack of communication"", ""Diverging goals and objectives"", ""Redundant efforts"", ""Shared goals, effective communication, and coordination mechanisms""]","Shared goals, effective communication, and coordination mechanisms",2,3,10,0,"2023-09-25 08:56:14","2023-09-25 08:56:14"
1205,7cae785e-79d6-4f7b-8c3e-e0e360b99eec,"Healthcare providers collaborate primarily to:",2,1,"[""Increase healthcare costs"", ""Fragment healthcare services"", ""Deliver comprehensive and coordinated care"", ""Reduce patient involvement in care""]","Deliver comprehensive and coordinated care",2,3,10,0,"2023-09-25 08:56:14","2023-09-25 08:56:14"
1206,6e38917a-8685-4916-ab79-13491143704f,"Public health agencies aim to:",2,1,"[""Focus solely on disease treatment"", ""Promote health and prevent diseases"", ""Isolate healthcare providers"", ""Ignore health promotion efforts""]","Promote health and prevent diseases",2,3,10,0,"2023-09-25 08:56:14","2023-09-25 08:56:14"
1207,a9fdbe99-bf56-4763-97f7-9f9e66cba17e,"Government agencies collaborate to address the:",2,1,"[""Pharmaceutical pricing crisis"", ""Social determinants of health"", ""Healthcare workforce shortage"", ""Academic research gap""]","Social determinants of health",2,3,10,0,"2023-09-25 08:56:14","2023-09-25 08:56:14"
1208,b0796310-9efc-4caa-8087-52b7b13a1455,"NGOs complement healthcare efforts by:",2,1,"[""Limiting community engagement"", ""Reducing access to healthcare"", ""Providing community resources and community engagement"", ""Ignoring health disparities""]","Providing community resources and community engagement",2,3,10,0,"2023-09-25 08:56:14","2023-09-25 08:56:14"
1209,73b0e7a5-4acd-4cce-87f1-566c8ef4a5a7,"Research and academic institutions collaborate to:",2,1,"[""Impede innovation"", ""Reduce healthcare costs"", ""Advance medical knowledge and improve patient outcomes"", ""Limit education opportunities""]","Advance medical knowledge and improve patient outcomes",2,3,10,0,"2023-09-25 08:56:14","2023-09-25 08:56:14"
1210,dfacade5-a2f8-40e7-8f79-61e2584e8898,"The private sector contributes to healthcare through avenues such as pharmaceutical companies and medical device manufacturers by:",2,1,"[""Isolating themselves from healthcare initiatives"", ""Reducing access to innovative treatments"", ""Collaborating on research and development, technology implementation, and health system strengthening"", ""Focusing solely on healthcare delivery""]","Collaborating on research and development, technology implementation, and health system strengthening",2,3,10,0,"2023-09-25 08:56:14","2023-09-25 08:56:14"
1211,5a00ee08-4470-4063-97e8-1ac5c7625d0a,"Which of the following is a method of funding secondary healthcare in Nigeria?",2,1,"[""Out-of-pocket payments by patients"", ""Donor funding exclusively"", ""Government budget allocation only"", ""Primary health insurance schemes""]","Out-of-pocket payments by patients",2,3,10,0,"2023-09-25 08:56:14","2023-09-25 08:56:14"
1212,523751a1-9b82-4e24-8cd6-383796667f4f,"What role does the National Health Insurance Scheme (NHIS) play in healthcare funding?",2,1,"[""Exclusively funds tertiary healthcare"", ""Provides health insurance for government employees only"", ""Offers health insurance schemes for different population segments"", ""Focuses solely on primary healthcare""]","Offers health insurance schemes for different population segments",2,3,10,0,"2023-09-25 08:56:14","2023-09-25 08:56:14"
1213,df668226-2f06-414e-a7bf-1c656f3125d5,"Why is healthcare funding important for healthcare access?",2,1,"[""To limit access to healthcare services"", ""To ensure equitable access to healthcare services"", ""To increase financial barriers to healthcare"", ""To promote socio-economic disparities""]","To ensure equitable access to healthcare services",2,3,10,0,"2023-09-25 08:56:14","2023-09-25 08:56:14"
1214,5389d033-62ee-476c-a96b-d32d5ee7b400,"How does healthcare funding contribute to the quality of care?",2,1,"[""By reducing investments in medical infrastructure"", ""By limiting staff training and education"", ""By supporting modern medical equipment and staff training"", ""By excluding research and development initiatives""]","By supporting modern medical equipment and staff training",2,3,10,0,"2023-09-25 08:56:14","2023-09-25 08:56:14"
1215,e5ceedc3-0b9f-48b2-a352-8f2b42c015a9,"What does adequate healthcare funding help in achieving regarding the healthcare workforce?",2,1,"[""High staff turnover"", ""Competitive salaries and professional development"", ""Reduced staffing levels"", ""Limited access to healthcare services""]","Competitive salaries and professional development",2,3,10,0,"2023-09-25 08:56:14","2023-09-25 08:56:14"
1216,e22ce46a-6f1f-4f07-a8b5-2eb4cf11e957,"How does healthcare funding support research and innovation?",2,1,"[""By discouraging research projects and clinical trials"", ""By excluding technological advancements"", ""By limiting investments in research and development"", ""By funding research projects and clinical trials""]","By funding research projects and clinical trials",2,3,10,0,"2023-09-25 08:56:14","2023-09-25 08:56:14"
1217,c4526e66-ec49-44ef-8722-4d8645a17447,"What does healthcare funding enable in terms of health system strengthening?",2,1,"[""Weakening of healthcare systems"", ""Inadequate healthcare infrastructure"", ""Efficient healthcare delivery and disease surveillance"", ""Lack of health policies and regulations""]","Efficient healthcare delivery and disease surveillance",2,3,10,0,"2023-09-25 08:56:14","2023-09-25 08:56:14"
1218,5a30a255-1807-42b7-acd6-2ca8c2c5d234,"How does healthcare funding contribute to health promotion and disease prevention?",2,1,"[""By reducing funding for public health campaigns"", ""By focusing on expensive treatments only"", ""By investing in preventive healthcare measures and public health campaigns"", ""By limiting access to screening services""]","By investing in preventive healthcare measures and public health campaigns",2,3,10,0,"2023-09-25 08:56:14","2023-09-25 08:56:14"
1219,e40edf64-fb62-4d29-a20c-174c9e9eebb2,"Which of the following is NOT a source of healthcare funding in Nigeria?",2,1,"[""Out-of-pocket payments by patients"", ""Government budget allocation"", ""Donor funding exclusively"", ""National Health Insurance Scheme (NHIS)""]","Donor funding exclusively",2,3,10,0,"2023-09-25 08:56:14","2023-09-25 08:56:14"
1220,7fb4da2b-16ea-4a68-a916-f73b0005b465,"What role does out-of-pocket payments by patients play in healthcare funding?",2,1,"[""It reduces financial barriers to healthcare."", ""It exclusively funds primary healthcare."", ""It supports healthcare infrastructure development."", ""It limits healthcare access for low-income individuals.""]","It limits healthcare access for low-income individuals.",2,3,10,0,"2023-09-25 08:56:14","2023-09-25 08:56:14"
1221,7ea3dd67-4bc6-4631-9ebb-06746ad68298,"What is the importance of healthcare funding?",2,1,"[""To limit access to healthcare services"", ""To increase financial barriers to healthcare"", ""To promote socio-economic disparities"", ""To ensure access to quality healthcare services and improve health outcomes""]","To ensure access to quality healthcare services and improve health outcomes",2,3,10,0,"2023-09-25 08:56:14","2023-09-25 08:56:14"
1222,be7d7515-baec-4905-87e2-00103b245ab3,"What is one of the key responsibilities of nurses in primary care planning?",2,1,"[""Conducting advanced surgical procedures"", ""Developing care plans for specialized conditions"", ""Conducting comprehensive health assessments"", ""Leading research and evidence-based practice initiatives""]","Conducting comprehensive health assessments",2,3,10,0,"2023-09-25 08:56:14","2023-09-25 08:56:14"
1223,bc0dd9fd-af64-4e95-9cf7-7319ff00d61e,"In secondary care planning, what is a significant role of nurses in care coordination?",2,1,"[""Conducting complex surgical procedures"", ""Coordinating care across different departments"", ""Leading policy development initiatives"", ""Providing health education to patients""]","Coordinating care across different departments",2,3,10,0,"2023-09-25 08:56:14","2023-09-25 08:56:14"
