id,uuid,question,assessment_id,user_id,options,correct_answer,question_score,class_id,subject_id,is_synced,created_at,updated_at
828,fe6fe487-30b8-47fd-a0d0-6d16ce35cc39,"The bones, muscles, heart, blood vessels, etc are formed from the ",1,1,"[""Ectoderm "", ""Mesoderm "", ""Endoderm"", ""Syncytium ""]","Mesoderm ",2,2,7,0,"2023-09-20 15:23:15","2023-09-20 15:23:15"
829,006a1782-c816-4738-9244-54354fda53ec,"_____ develops to become the umbilical cord ",1,1,"[""Inner cell mass "", ""Yolk sac "", ""Body stalk "", ""Mesoderm ""]","Body stalk ",2,2,7,0,"2023-09-20 15:23:15","2023-09-20 15:23:15"
830,550a3ffb-95ca-451a-add5-2f02a7e7c749,"Which of these statements is more correct ",1,1,"[""The trophoblast form the inner cell mass while the fetus develops from the mesoderm "", ""The yolk sac lies on the side of the ectoderm and provides nourishment for the embryo "", ""The amniotic cavity lies on the side of the endoderm "", ""The parietal decidua lines the remainder of the uterine cavity ""]","The parietal decidua lines the remainder of the uterine cavity ",2,2,7,0,"2023-09-20 15:23:15","2023-09-20 15:23:15"
831,23bfb6f3-2487-4634-9cbd-a8201f7554d8,"One of these is not a structure formed by the inner cell mass ",1,1,"[""Chorion "", ""Amnion "", ""Fetus "", ""Umbilical cord ""]","Chorion ",2,2,7,0,"2023-09-20 15:23:15","2023-09-20 15:23:15"
832,fa8ee0e6-fe5d-4e39-9593-d19093174935,"The hollow distensible fibromuscular tube the extend from the vestibule to the cervix is called ",1,1,"[""Uterus "", ""Urethra "", ""Vagina "", ""Fallopian tube ""]","Vagina ",2,2,7,0,"2023-09-20 15:23:15","2023-09-20 15:23:15"
833,3ca82079-524f-4ac7-bf4c-683fdd2cda07,"A fibromuscular distensible tube measures 10cm in length and 2.5cm diameter is called ",1,1,"[""Batholins duct "", ""Clitoris "", ""Vagina "", ""Fallopian tube ""]","Vagina ",2,2,7,0,"2023-09-20 15:23:15","2023-09-20 15:23:15"
834,87e52a8b-7eab-4ccf-a0c3-d5e970f86a62,"The activity of _____ produces the strong acidic state of the vaginal mucus ",1,1,"[""Haemophillus influenza "", ""Doderlein’s baccilli "", ""Streptococcus bacilli"", ""Staphylococcus bacilli ""]","Doderlein’s baccilli ",2,2,7,0,"2023-09-20 15:23:15","2023-09-20 15:23:15"
835,1c54d143-426c-44cd-99d2-2e300e2b6efd,"All of the following except one is the route for lymphatic drainage of the vagina ",1,1,"[""Internal illiac glands "", ""Inguinal glands "", ""Sacral glands "", ""Pelvic glands ""]","Pelvic glands ",2,2,7,0,"2023-09-20 15:23:15","2023-09-20 15:23:15"
836,56f3e687-24f1-4c87-bd4c-cc5292796962,"One of these is not a function of the vagina ",1,1,"[""Nourishment for the penis "", ""Receives the penis and semen "", ""Escape the menstruation "", ""Exit for the fetus at birth ""]","Nourishment for the penis ",2,2,7,0,"2023-09-20 15:23:15","2023-09-20 15:23:15"
837,4757986d-194c-4e8e-bf47-9539415a3dd4,"The placenta has _____ surfaces ",1,1,"[1, 3, 4, 2]",2,2,2,7,0,"2023-09-20 15:23:15","2023-09-20 15:23:15"
838,5c791b42-7d6e-4dd7-a0c0-733a6d38dd15,"The shinning surface with blood vessels spreading on it from insertion of the cord is known as ",1,1,"[""Maternal surface "", ""Fetal surface "", ""Amniotic surface "", ""Chorionic surface ""]","Fetal surface ",2,2,7,0,"2023-09-20 15:23:15","2023-09-20 15:23:15"
839,b498beff-7178-4cfc-8ba1-6d2f03e4b3bf,"______ of the male child remain dormant until they are stimulated at the age of 10 to 14 by gonadotropic hormones ",1,1,"[""Scrotum"", ""Penis "", ""Ejaculation "", ""Testes ""]","Testes ",2,2,7,0,"2023-09-20 15:23:15","2023-09-20 15:23:15"
840,4faf6469-6fa9-4cae-ad6b-018a8d62b359,"The gonadotropic hormone releasing factor is secreted by the _____",1,1,"[""Pituitary gland "", ""Hypothalamus "", ""Adrenoid gland "", ""Intestinal gland ""]","Hypothalamus ",2,2,7,0,"2023-09-20 15:23:15","2023-09-20 15:23:15"
841,0aa66b7d-5e16-4328-9c4b-801219a4eb9c,"______causes proliferation of the cells in the germinal epithelium ",1,1,"[""Androgen "", ""Follicle Stimulating hormone "", ""Progestogen "", ""Semiferous tubules ""]","Follicle Stimulating hormone ",2,2,7,0,"2023-09-20 15:23:15","2023-09-20 15:23:15"
842,2c0b3405-2055-49da-85b1-674ebe92e80b,"______causes the production of testosterone by the interstitial cells",1,1,"[""Luteinizing Hormone"", ""Follicle Stimulating hormone "", ""Androgen"", ""Progesterone ""]","Luteinizing Hormone",2,2,7,0,"2023-09-20 15:23:15","2023-09-20 15:23:15"
843,210e37d6-5793-42f7-9cb9-7e7ab16232db,"The enlargement of testes is caused by ",1,1,"[""Spermatocytes "", ""Testosterone "", ""Progesterone "", ""Ovaries ""]","Testosterone ",2,2,7,0,"2023-09-20 15:23:16","2023-09-20 15:23:16"
844,3e94ff7c-7d32-4e00-bbad-916eaaed1879,"The testosterone causes the testes to desend from the abdominal cavity into ",1,1,"[""Scrotum "", ""Prostrate "", ""Seminal vesicles "", ""Skyneal""]","Scrotum ",2,2,7,0,"2023-09-20 15:23:16","2023-09-20 15:23:16"
845,b0189b57-f158-4557-8d9c-1835fbc74bef,"Testosterone accelerates the formulation of the following ",1,1,"[""Penis "", ""Prostrate "", ""Seminal vesicles "", ""Scrotumacia ""]","Scrotumacia ",2,2,7,0,"2023-09-20 15:23:16","2023-09-20 15:23:16"
846,685ae553-2712-4e70-a344-3d0fe87876f8,"At puberty, the reinstitution of testosterone secretion causes the male sex organs to enlarge ",1,1,"[""Ten fold "", ""Twenty fold"", ""Fifteen fold "", ""Five fold ""]","Ten fold ",2,2,7,0,"2023-09-20 15:23:16","2023-09-20 15:23:16"
847,92a839a7-675f-4115-b930-74a3315ab1fd,"Testosterone exerts other general effects throughout the body to give adult male his distinctive characteristic except ",1,1,"[""It promotes hereditary growth of hair on his face "", ""It causes baldness to male who are predispose to baldness "", ""It increases the growth of the larynx so that the male after puberty develops a deeper pitch to his voice "", ""It increases the bone marrow ""]","It increases the bone marrow ",2,2,7,0,"2023-09-20 15:23:16","2023-09-20 15:23:16"
848,26537584-6c71-4e70-91af-b27acbb42fb1,"______ is the period of biological transition from childhood to adulthood ",1,1,"[""Genetic "", ""Adulicent "", ""Growth"", ""Puberty ""]","Puberty ",2,2,7,0,"2023-09-20 15:23:16","2023-09-20 15:23:16"
849,4bfd88bf-9e8f-47b4-a1f1-6faaf3ffb00b,"The biological changes that occur during pubertal period are related directly or indirectly to ",1,1,"[""Sex steroid stimulation "", ""Transitional period "", ""Anterior pituitary gland "", ""Gomadol hormone ""]","Sex steroid stimulation ",2,2,7,0,"2023-09-20 15:23:16","2023-09-20 15:23:16"
850,edd471b7-06a7-46a1-a507-553d9bc2d749,"Under the influence of anterior pituitary gland, the ovaries secrete principally two hormones ______ and ______",1,1,"[""Oestrogen and Progestogen "", ""Oestrodial and Oestrodin "", ""Corpus luteum and Oestrodial "", ""Oestrus and Oestrodial ""]","Oestrogen and Progestogen ",2,2,7,0,"2023-09-20 15:23:16","2023-09-20 15:23:16"
851,70dc2044-7488-4bf5-bb0c-22ee7b334971,"_______ is known as the yellow body ",1,1,"[""Corpus luteum "", ""Follicular phase "", ""Ovaries "", ""Spleen ""]","Corpus luteum ",2,2,7,0,"2023-09-20 15:23:16","2023-09-20 15:23:16"
852,198a1a8e-3c0c-4a19-94bd-ac67d748535f,"The fall in the blood level of Oestrogen and Progestogen is due to degeneration of ",1,1,"[""Oestrus "", ""Fallopian tube "", ""Corpus luteum"", ""Follicle stimulating hormone ""]","Corpus luteum",2,2,7,0,"2023-09-20 15:23:16","2023-09-20 15:23:16"
853,1c7ac830-0e8f-48f2-bf8f-5da010df5569,"A fall in hormonal level causes the end metrium to break down and leads to ",1,1,"[""Menstruation "", ""Corpus leutuem "", ""Hypertrophy "", ""Vascularity ""]","Menstruation ",2,2,7,0,"2023-09-20 15:23:16","2023-09-20 15:23:16"
854,7e024f40-a7ef-4a47-9ec9-6c23ffb4c6b7,"In female, Oestrus or sexual heat plays very little part in ",1,1,"[""Sexual desire "", ""Menstruation "", ""Ovulation "", ""Pigmentation ""]","Sexual desire ",2,2,7,0,"2023-09-20 15:23:16","2023-09-20 15:23:16"
855,52077f21-fa53-4b44-90cd-76a2ba302c33,"_______ act on the glycogen to produce lactic acid which maintains the acidity of the vagina and prevent infection ",1,1,"[""Doderleins bacilli "", ""Leinsdoder cilli "", ""Stratified epithelium "", ""Columnar epithelium ""]","Doderleins bacilli ",2,2,7,0,"2023-09-20 15:23:16","2023-09-20 15:23:16"
856,a5fdaeba-0432-4b91-9689-d4ec6500e0b0,"______modifies the consistency of the cervical mucus ",1,1,"[""Oestrogen "", ""Proliferative hormone "", ""Leinsoder "", ""Fallopian tube ""]","Oestrogen ",2,2,7,0,"2023-09-20 15:23:16","2023-09-20 15:23:16"
857,37a6e68f-d5fa-48dd-9391-3c08484f00c1,"Oestrogen brings about the ______ of the areola. ",1,1,"[""Pigmentation "", ""Darkening "", ""Fine shape "", ""Myometrium ""]","Pigmentation ",2,2,7,0,"2023-09-20 15:23:16","2023-09-20 15:23:16"
858,3296ba7f-7a90-4a15-83df-02f48b42a102,"______ plays a key role in increasing bone mineral density in puberty and into adulthood ",1,1,"[""Androgen "", ""Genodrogen "", ""Progestogen "", ""Accini cell ""]","Androgen ",2,2,7,0,"2023-09-20 15:23:16","2023-09-20 15:23:16"
859,f867680d-3798-4744-bb60-e7672ab12e23,"Fossa Ovalis and hypogastric arteries are known as ",1,1,"[""Adaptation "", ""Ossification "", ""Obliterated hypogastric arteries "", ""Fontanells ""]","Obliterated hypogastric arteries ",2,2,7,0,"2023-09-20 15:23:16","2023-09-20 15:23:16"
860,7faa1823-1d23-4890-a58e-221ba4463a62,"After birth, the baby has to obtain nutrition through the establishment of ",1,1,"[""Breast feeding or breast feeding substitute "", ""Cerelac "", ""Custard "", ""Cornflakes ""]","Breast feeding or breast feeding substitute ",2,2,7,0,"2023-09-20 15:23:16","2023-09-20 15:23:16"
861,51c42857-52d2-42b2-9da4-d5274826eed3,"After birth, the baby eliminates waste via the ",1,1,"[""Placenta "", ""Anus "", ""Kidneys and gastrointestinal system"", ""Ambiguous genitalia ""]","Kidneys and gastrointestinal system",2,2,7,0,"2023-09-20 15:23:16","2023-09-20 15:23:16"
862,80565f99-0959-4ce1-a466-7839a40c5154,"Other complex changes that takes place after birth includes",1,1,"[""Hydrocephalus "", ""Incontinent"", ""The relationship between parents and child "", ""Hypothalamus ""]","The relationship between parents and child ",2,2,7,0,"2023-09-20 15:23:16","2023-09-20 15:23:16"
863,74cbf29c-1b60-4e00-80f6-d11e10f5ea25,"The interaction of _____ and _____ maintain water and sodium balance ",1,1,"[""Aldosterone and antiduretic hormone (ADH) "", ""Oestrogen and progesterone "", ""Testestorone and Lutinizing hormone "", ""Aldosterone and Oestrogen ""]","Aldosterone and antiduretic hormone (ADH) ",2,2,7,0,"2023-09-20 15:23:16","2023-09-20 15:23:16"
864,59c12b12-6dda-4b34-83f1-168a9b5c2ba3,"The breast evolves from ______ through pregnancy and Puerperium ",1,1,"[""Birth "", ""Puberty "", ""Delivery "", ""Adulthood""]","Puberty ",2,2,7,0,"2023-09-20 15:23:16","2023-09-20 15:23:16"
865,e66d67a8-2e83-4410-b098-aef4d2979f3a,"The ______is a symbol of feminity ",1,1,"[""Menstruation "", ""Ova"", ""Breast "", ""Structure ""]","Breast ",2,2,7,0,"2023-09-20 15:23:16","2023-09-20 15:23:16"
866,b63f4273-4fd1-489c-b81c-782c86e62418,"The mammary glands are ______ organs of the reproduction ",1,1,"[""Axilery "", ""Intermediary "", ""main "", ""Accessory""]",Accessory,2,2,7,0,"2023-09-20 15:23:16","2023-09-20 15:23:16"
867,71294d99-6b22-4950-ae7c-089474dffd5f,"At birth, the breast tissue is swollen due to the action of ",1,1,"[""Blood circulation "", ""Development "", ""Maturation "", ""Hormone ""]","Hormone ",2,2,7,0,"2023-09-20 15:23:16","2023-09-20 15:23:16"
868,7f9ee91e-8bee-429f-b877-a03e5d4a3b7b,"_______ is the breast tissue extending towards the axilla ",1,1,"[""Axillery tail of Spence "", ""The nipple "", ""Mammary glands "", ""Axillery organ ""]","Axillery tail of Spence ",2,2,7,0,"2023-09-20 15:23:16","2023-09-20 15:23:16"
869,7f707f8d-f8c5-4df3-8fe6-8f9f76db416b,"Each aveoli of the breast is lined by the_____ cells ",1,1,"[""Basket "", ""Acini "", ""Circular "", ""Longitudinal ""]","Acini ",2,2,7,0,"2023-09-20 15:23:16","2023-09-20 15:23:16"
870,111f5142-1368-4f16-8007-a1662d65f71d,"Around each aveolus lies myoepithelial cells sometimes called _____ cells ",1,1,"[""Acini "", ""Circular "", ""Spider "", ""Longitudinal ""]","Spider ",2,2,7,0,"2023-09-20 15:23:16","2023-09-20 15:23:16"
871,300c66f0-9454-4b1c-8c79-d3db28bbcbcb,"The widened out position of the duct where milk is stored is called _____",1,1,"[""Tubules "", ""Ductus "", ""Nipple "", ""Ampula ""]","Ampula ",2,2,7,0,"2023-09-20 15:23:16","2023-09-20 15:23:16"
872,3916029d-12f4-47a1-8e13-e37df70c23e2,"The breast is situated between the level of ______ ribs ",1,1,"[""2nd - 6th "", ""2nd - 4th "", ""1st - 5th "", ""1st - 7th ""]","2nd - 6th ",2,2,7,0,"2023-09-20 15:23:16","2023-09-20 15:23:16"
873,122d70dd-e8b9-45f6-8281-5dfa433ba704,"The glendular tissue of the breast is divided into about _____ lobes ",1,1,"[16, 18, 20, 21]",18,2,2,7,0,"2023-09-20 15:23:16","2023-09-20 15:23:16"
874,fce8273c-363b-489b-ba7b-b4b17196f879,"Ovaries are components of the female reproductive system and ____ system",1,1,"[""Circulatory "", ""Nervous "", ""Endocrine "", ""Excretory ""]","Endocrine ",2,2,7,0,"2023-09-20 15:23:16","2023-09-20 15:23:16"
875,c3c3ce38-856a-4b81-b1ba-697f17508ac5,"The ovaries are homologous with the _____",1,1,"[""Nipple "", ""Ova "", ""Ovum "", ""Testes ""]","Testes ",2,2,7,0,"2023-09-20 15:23:16","2023-09-20 15:23:16"
876,253e63d7-07cb-4b56-9ba9-3c4d059634e2,"Each ovary weighs about ______ grams ",1,1,"[3, 5, 6, 8]",3,2,2,7,0,"2023-09-20 15:23:16","2023-09-20 15:23:16"
877,2d8e46ad-86a2-4312-b4a4-029324485727,"The broad ligament relates to the ovaries ",1,1,"[""Anteriorly "", ""Posteriorly "", ""Medially "", ""Laterally ""]","Anteriorly ",2,2,7,0,"2023-09-20 15:23:16","2023-09-20 15:23:16"
878,0847dfe0-0330-4826-9d2d-329597a99eef,"The infundibulopelvic ligaments bounds the ovaries ",1,1,"[""Medially"", ""Laterally"", ""Anteriorly "", ""Posteriorly ""]",Laterally,2,2,7,0,"2023-09-20 15:23:16","2023-09-20 15:23:16"
879,6c01408e-523b-46d3-8d6c-e67c2739e9e2,"The intestines relates with the ovaries ",1,1,"[""Laterally "", ""Medially "", ""Posteriorly "", ""Anteriorly ""]","Posteriorly ",2,2,7,0,"2023-09-20 15:23:16","2023-09-20 15:23:16"
880,4e9aa7a2-4018-450b-8589-eade4aa14697,"The uterus, the ovarian ligaments relates to the ovaries ",1,1,"[""Anteriorly "", ""Posteriorly "", ""Laterally "", ""Medially""]",Medially,2,2,7,0,"2023-09-20 15:23:16","2023-09-20 15:23:16"
881,4ddf5d06-382b-4028-ba76-f0139648e9d7,"The ovaries are attached to the _____ ligaments ",1,1,"[""Broad "", ""Treitz "", ""Rubocapsular "", ""Cotyloid ""]","Broad ",2,2,7,0,"2023-09-20 15:23:16","2023-09-20 15:23:16"
882,f8d7bcfc-e893-4947-8b92-af2eaa014172,"______ is the outer layer of the ovary ",1,1,"[""Medulla "", ""Cortex"", ""Cornuous "", ""Mesovarium ""]",Cortex,2,2,7,0,"2023-09-20 15:23:16","2023-09-20 15:23:16"
883,93c599d1-a766-484d-a1b5-564637e85262,"_____ is the central portion of the ovary ",1,1,"[""Musoverium "", ""Cornuous "", ""Medulla "", ""Cortex ""]","Medulla ",2,2,7,0,"2023-09-20 15:23:16","2023-09-20 15:23:16"
884,76df89eb-a49c-4cff-b402-9447253d8829,"The uterus is ______ in shape ",1,1,"[""Almon "", ""Elastic muscular organ "", ""Hollow pear -shaped muscular organ "", ""Kidney shape organ ""]","Hollow pear -shaped muscular organ ",2,2,7,0,"2023-09-20 15:23:16","2023-09-20 15:23:16"
885,9d7c5fe6-e596-43ff-8839-e1a6b53a7dc2,"The uterus is situated between ______and _____ organ ",1,1,"[""Bladder and the ruction "", ""Bladder and the pancrease "", ""Rectum and the liver "", ""Bladder, Rectum and Liver ""]","Bladder and the ruction ",2,2,7,0,"2023-09-20 15:23:16","2023-09-20 15:23:16"
886,604eb6f3-f680-4ca4-afd2-dc2a028ef950,"When the woman is in standing position the uterine fundus rest on ______organ ",1,1,"[""Kidney "", ""Bladder "", ""Vagina "", ""Cervix ""]","Bladder ",2,2,7,0,"2023-09-20 15:23:16","2023-09-20 15:23:16"
887,1a9c6b22-518f-4b03-aeef-61504e655d58,"The non-pregant uterus is ___ cm long ",1,1,"[""10cm "", ""9cm"", ""7.5cm"", ""20cm""]",7.5cm,2,2,7,0,"2023-09-20 15:23:16","2023-09-20 15:23:16"
888,19d9e84a-eecb-4d2e-b008-4126a67c2348,"_____ is a narrow opening between the isthmus and cervix ",1,1,"[""Internal OS "", ""External OS "", ""Cervix neck "", ""Isthmus ""]","Internal OS ",2,2,7,0,"2023-09-20 15:23:16","2023-09-20 15:23:16"
889,08beda8e-eed2-4291-bef5-f4285736e574,"The microscopic structure on the uterus is divided into ______ layers ",1,1,"[""2 layers "", ""4 layers "", ""5 layers "", ""3 layers ""]","3 layers ",2,2,7,0,"2023-09-20 15:23:16","2023-09-20 15:23:16"
890,ba9eceae-ea35-4011-8d7d-372622c01169,"_____ is the doomed upper wall between the insertions of the uterine tubes ",1,1,"[""Fundus "", ""Cornia "", ""Corpus "", ""Cavity ""]","Fundus ",2,2,7,0,"2023-09-20 15:23:16","2023-09-20 15:23:16"
891,df5fd9bb-8604-46a1-91d5-f5120ed040fe,"Interiorly to the uterus lies ____ organ ",1,1,"[""Fundus "", ""Fallopian tube "", ""Vagina "", ""Vulva ""]","Vagina ",2,2,7,0,"2023-09-20 15:23:16","2023-09-20 15:23:16"
892,167a2f28-c93e-411d-8ded-9b431bf7c8cf,"Superiorly to the uterus lies which organ ",1,1,"[""Intestine "", ""Vagina "", ""Vulva "", ""Heart ""]","Intestine ",2,2,7,0,"2023-09-20 15:23:16","2023-09-20 15:23:16"
893,d64407b5-d316-4486-a4ee-ea05b251589e,"______ is a small, extremely sensitive erectile structure, situated within the fold or the prepuse ",1,1,"[""Vestibule "", ""Urethral meatus "", ""Clitoris "", ""Orifice ""]","Clitoris ",2,2,7,0,"2023-09-20 15:23:16","2023-09-20 15:23:16"
894,1598ba0e-9a52-4a9d-a9a7-531001c1b5d0,"The upper folds of the labium minus limit to form ______",1,1,"[""Vestibule "", ""Prepuce "", ""Vagina "", ""Cervix ""]","Prepuce ",2,2,7,0,"2023-09-20 15:23:16","2023-09-20 15:23:16"
895,270405b4-ce68-4b3a-8329-8d6aabe5577d,"The vagina orifice is also known as ",1,1,"[""Introitus "", ""Hymen "", ""Orifice "", ""Vulva ""]","Introitus ",2,2,7,0,"2023-09-20 15:23:16","2023-09-20 15:23:16"
896,89c283ac-d91e-4aa6-a1f8-5d156a2592de,"______ is a potential canal which extends from the vulva to the uterus ",1,1,"[""Cervix "", ""Vagina "", ""Vulva "", ""Uterus ""]","Vagina ",2,2,7,0,"2023-09-20 15:23:16","2023-09-20 15:23:16"
897,bdf0052e-2087-4f0f-8bab-5157f693b5b2,"The upper end of the vagina is known as _______",1,1,"[""Vault "", ""Projection "", ""Orifice "", ""Tube ""]","Vault ",2,2,7,0,"2023-09-20 15:23:16","2023-09-20 15:23:16"
898,f8af5534-d223-44f7-91fd-c0830344c87b,"The first sign of early skull development occurs at the end of _____ week intrauterine life ",1,1,"[4, 5, 7, 3]",4,2,2,7,0,"2023-09-20 15:23:16","2023-09-20 15:23:16"
899,19e1bf71-d86c-441a-834e-5a4eea5899e5,"Calcification begins as early as ____ weeks following conception ",1,1,"[5, 6, 7, 8]",5,2,2,7,0,"2023-09-20 15:23:16","2023-09-20 15:23:16"
900,1f182785-2315-41b7-a757-433075ff1230,"The placenta is _____ cm thick ",1,1,"[""2cm "", ""2.5cm "", ""2.8cm"", ""2.6cm""]","2cm ",2,2,7,0,"2023-09-20 15:23:16","2023-09-20 15:23:16"
901,28154575-29ab-4796-bd98-557e80f76ee3,"The maternal surface of the placenta is ______ in colour due to maternal blood supply ",1,1,"[""Purple "", ""Blue "", ""Dark red "", ""Red ""]","Dark red ",2,2,7,0,"2023-09-20 15:23:16","2023-09-20 15:23:16"
902,a1578be9-908d-445b-8854-f4a2a80f76a3,"The meteruillow space contain approximately_____ m/s or blood which changed at least three times per minutes ",1,1,"[""100m/s "", ""150m/s "", ""200m/s "", ""250m/s ""]","150m/s ",2,2,7,0,"2023-09-20 15:23:16","2023-09-20 15:23:16"
903,dd6d1572-aa22-42e6-b868-87280ddddba0,"______ is an opaque, thin fiable membrane that covers the fetal side or the placenta ",1,1,"[""Chorion "", ""Amnion "", ""Amiotic fluid "", ""Chronic villi ""]","Chorion ",2,2,7,0,"2023-09-20 15:23:16","2023-09-20 15:23:16"
904,f5a1db41-45b1-4d6a-bb03-c6309b6bae24,"Following conception HCG reaches its peak at ______ ",1,1,"[""60days "", ""70days "", ""80days "", ""65days ""]","60days ",2,2,7,0,"2023-09-20 15:23:16","2023-09-20 15:23:16"
905,f755a15d-21b4-4f12-b9a1-f95735f92df0,"Which of the following is not a component of the male reproductive system",1,1,"[""Testes"", ""Urethra"", ""Ovaries "", ""Epididymis""]","Ovaries ",2,2,7,0,"2023-09-20 15:23:16","2023-09-20 15:23:16"
906,2548885c-43b1-4a6e-9cd0-3647b6406d1f,"In fetal circulation, which vessel carries oxygenated blood from the placenta to the fetus?",1,1,"[""Umblical Vein"", ""Umblical Artery"", ""Aorta"", ""Pulmonary Artery""]","Umblical Vein",2,2,7,0,"2023-09-20 15:23:16","2023-09-20 15:23:16"
907,74de4a7e-2198-4260-b70f-989d3712eae6,"Failure of the foramen ovale to close after birth can result in which of the following complications?",1,1,"[""Hypertension"", ""Cyanosis"", ""Osteoporosis"", ""Diabetes Mellitus""]",Cyanosis,2,2,7,0,"2023-09-20 15:23:16","2023-09-20 15:23:16"
908,71c2a96e-9c1e-43dd-a953-40a53e4f49c2,"What is the primary function of the vas deferens?",1,1,"[""Storage of Sperm"", ""Production of Tesosterone"", ""Transport of sperm from the testes to the urethra"", ""Secretion of seminal fluid""]","Transport of sperm from the testes to the urethra",2,2,7,0,"2023-09-20 15:23:16","2023-09-20 15:23:16"
909,a9f6b0fd-ce8a-4b8a-8e98-83da4b47898a,"Which part of the male reproductive system is responsible for producing seminal fluid?",1,1,"[""Testes"", ""Prostrate gland"", ""Vas deferens"", ""Epididymis""]","Prostrate gland",2,2,7,0,"2023-09-20 15:23:16","2023-09-20 15:23:16"
910,a5522c2b-a77c-4b51-9a1d-4794555e6405,"Which of the following is responsible for the production of sperm in the testes",1,1,"[""Seminal vesicles"", ""Epididymis"", ""Vas deferens"", ""Seminiferous tubles""]","Seminiferous tubles",2,2,7,0,"2023-09-20 15:23:16","2023-09-20 15:23:16"
911,0f69b75b-5141-4014-ad10-5cf433a068a5,"Which hormone is responsible for regulating the production of testosterone in the male reproductive system?",1,1,"[""Estrogen"", ""Follicle-stimulating hormone (FSH) "", ""Luteinizing hormone (LH)"", ""Prolactin""]","Luteinizing hormone (LH)",2,2,7,0,"2023-09-20 15:23:16","2023-09-20 15:23:16"
912,85fb6979-65f1-4ab4-99aa-db8c2156d666,"Which of the following is a function of testosterone in the male reproductive system",1,1,"[""Promoting breast development"", ""Stimulating ovulation"", ""Enhancing muscle growth and bone density"", ""Regulating the menstrual cycle""]","Enhancing muscle growth and bone density",2,2,7,0,"2023-09-20 15:23:16","2023-09-20 15:23:16"
913,4658188a-dc30-4a80-901c-7af93ac9f841,"Which fetal vessel carries deoxygenated blood from the fetal heart to the placenta for oxygenation?",1,1,"[""Lungs"", ""Umblical Artery"", ""Iliac vein"", ""Superior Vena Cava""]","Umblical Artery",2,2,7,0,"2023-09-20 15:23:16","2023-09-20 15:23:16"
914,ae7bb12d-ab80-4f28-9c71-70bf4244f1cc,"The international confederation of midwifes (ICM) developed a definition of the therm midwife in ______",1,1,"[1962, 1974, 1972, 1980]",1972,2,2,8,0,"2023-09-20 15:27:33","2023-09-20 15:27:33"
915,9fa0b72f-f127-4455-8557-b95d3eab47de,"The ICM definition of the term midwife was later amended and ratified by _______ in 1992",1,1,"[""IFGO"", ""WHO"", ""ICN"", ""UNICEF""]",WHO,2,2,8,0,"2023-09-20 15:27:33","2023-09-20 15:27:33"
916,c12543c2-b8bc-4d2a-b6f4-0bdf75fe3f7f,"The word midwife is derived from an Anglosaxon word meaning __________",1,1,"[""\"for woman\""", ""\"with wife\""", ""\"with care\""", ""\"with woman\"""]","""with woman""",2,2,8,0,"2023-09-20 15:27:33","2023-09-20 15:27:33"
917,c8f3824a-167a-413e-ade5-dfddefcad51b,"According to the ancient Jews, the midwifes were called ________",1,1,"[""wise women"", ""Supportive women"", ""with women"", ""sage women""]","wise women",2,2,8,0,"2023-09-20 15:27:33","2023-09-20 15:27:33"
918,80409e8a-080f-4da3-9521-a4d3215163ca,"According to France, a midwife is known as ",1,1,"[""Sage feminine"", ""With woman"", ""Supportive woman"", ""Wise woman""]","Sage feminine",2,2,8,0,"2023-09-20 15:27:33","2023-09-20 15:27:33"
919,7f457569-f336-4c73-8dd3-76dda1fd79a2,"Biblical references to midwifes have been seen to their honour as mentioned in the following books except",1,1,"[""Genesis 35: 17-18"", ""Exodus 15: 21"", ""Exodus 16:31"", ""Genesis 38: 28 - 30""]","Exodus 16:31",2,2,8,0,"2023-09-20 15:27:33","2023-09-20 15:27:33"
920,1abe8266-9938-4bc6-aa32-19dd22e0c5d5,"In ancient primitive society, th work of the midwife has both _____ and ____ aspect",1,1,"[""Technical and Societal"", ""Manual and Automatic"", ""Technical and Magical aspect"", ""Mystical and ancient aspect""]","Technical and Magical aspect",2,2,8,0,"2023-09-20 15:27:33","2023-09-20 15:27:33"
921,f3532619-e2ca-4c2f-bdbc-6460a56fe9ef,"The book ""woman as heater"" which described witch hunt as ""an evil"" that surpassed rational understanding was written by_______",1,1,"[""Sullivan N."", ""Jeane Terachberg"", ""Janet Sullivan"", ""Jeane Achterberg""]","Jeane Achterberg",2,2,8,0,"2023-09-20 15:27:33","2023-09-20 15:27:33"
922,584c253c-8143-48c0-8621-c11ff3564723,"______ article stated ""Today, profssional are responsible for sttending to women labour and birth""",1,1,"[""Janet Sullivan "", ""Sulivan N."", ""Jeane Achterbeg"", ""Sullivan B""]","Sulivan N.",2,2,8,0,"2023-09-20 15:27:33","2023-09-20 15:27:33"
923,36843f7d-c2c2-4a6a-bff6-7241f6df6dcc,"In the prehistoric time, ______ and ______ were responsible for conducting dlivery of babies",1,1,"[""Midwifes"", ""Husbands and female relations "", ""Nurses and Midwifes"", ""Gynaecologists and midwifes""]","Husbands and female relations ",2,2,8,0,"2023-09-20 15:27:33","2023-09-20 15:27:33"
924,b6d8a367-ee1d-4a59-99c2-818ecb528a08,"In 500BC, the following were the methods used by the untrained women in the delivery of babies except",1,1,"[""Mannual dilation of the cervix"", ""Massaging of the abdomen"", ""Moulding of the head"", ""Upward and downward rmoval of placenta""]","Upward and downward rmoval of placenta",2,2,8,0,"2023-09-20 15:27:33","2023-09-20 15:27:33"
